{
  "contentSchemaVersion": "content-document@1",
  "identity": {
    "documentId": "textos-insight:observatory-not-cms",
    "contentType": "product_article",
    "slug": "observatory-not-cms",
    "language": "en",
    "title": "Why TextOS Is an Observatory, Not a CMS",
    "description": "TextOS is architecturally an observatory: scheduled, append-only observations of answer engines on a versioned panel — not a transactional CMS."
  },
  "editorial": {
    "authorIds": [
      "textos-editorial-team"
    ],
    "reviewerIds": [
      "marc-p"
    ],
    "primaryTopicId": "authority-observation",
    "topicIds": [
      "authority-observation",
      "product-doctrine"
    ],
    "audience": "reader-technical",
    "funnelStage": "consideration"
  },
  "truth": {
    "statusVocabulary": "textos.insights.ctc-article-system-1",
    "statusVocabularyVersion": "v1",
    "sourceStatus": "ARCHITECTURE_DECISION:DOCUMENTARY:draft",
    "publicationStatus": "draft",
    "allowedSurfaces": [
      "reference"
    ],
    "claimIds": [
      "m1-observation-unit",
      "m6-quality-ledger-contextualises",
      "hp1-measurement-doctrine"
    ],
    "evidenceRefs": [
      "observe-authority-presence:observe-run-orchestration-v1",
      "quality-ledger:quality-ledger-rates-v1"
    ],
    "capabilityIds": [
      "observe-authority-presence",
      "quality-ledger"
    ]
  },
  "provenance": {
    "sourceRepository": "gangster-nerd/textos-v0",
    "sourceEvidenceDigest": "eb2a09d09eaa031b1fb6541e48e91329a340807046750131b949251c6095a712",
    "sourceAuthority": "UNCERTIFIED"
  },
  "body": [
    {
      "id": "answer",
      "kind": "answer",
      "data": {
        "text": "TextOS is architected as an observatory, not a CMS. Its centre of gravity is the recurrent, append-only observation of answer engines on a versioned query panel. It does not manage user-triggered edits to content records; it accumulates dated observations and computes measurements over them."
      }
    },
    {
      "id": "h-what-kind-of-system-is-textos",
      "kind": "heading",
      "level": 2,
      "data": {
        "text": "What kind of system is TextOS?"
      }
    },
    {
      "id": "p-what-kind-of-system-is-textos",
      "kind": "paragraph",
      "data": {
        "text": "There is a temptation, when a product handles text and eventually helps write it, to file it under \"content management\". TextOS refuses that filing. Its core object is not a document a user edits, and its central operation is not a save. It is a **station of measurement** — an observatory whose first-class citizens are dated observations of what answer engines say."
      }
    },
    {
      "id": "h-the-three-archetypes-and-why-the-difference-matters",
      "kind": "heading",
      "level": 2,
      "data": {
        "text": "The three archetypes, and why the difference matters"
      }
    },
    {
      "id": "p-the-three-archetypes-and-why-the-difference-matters",
      "kind": "paragraph",
      "data": {
        "text": "A CMS-shaped system centres on **transactions**: users create records, edit them, and expect low-latency consistency. A media factory centres on **rendering**: heavy jobs, large artefacts, queues, object storage. An observatory centres on **repeated observation**: scheduled runs, tolerated partial failures, series that accumulate over time, and analysis that operates on the accumulated record."
      }
    },
    {
      "id": "h-the-observation-is-the-unit-not-the-brand",
      "kind": "heading",
      "level": 2,
      "data": {
        "text": "The observation is the unit, not the brand"
      }
    },
    {
      "id": "p-the-observation-is-the-unit-not-the-brand",
      "kind": "paragraph",
      "data": {
        "text": "The first architectural consequence: **the unit of measurement is the observation, not the brand**. One engine answer, at one moment, on one versioned query, in one locale, is the atom. Everything else — Direct Share of Model, Indirect Mention Share, Total Authority Presence — is a computation over a population of atoms. This is what [Authority Presence measurement](/methodology/authority-presence) sets out for the public methodology, and it is a direct consequence of ADR-001's decision to treat observations as first-class."
      }
    },
    {
      "id": "h-append-only-versioned-comparable-across-time",
      "kind": "heading",
      "level": 2,
      "data": {
        "text": "Append-only, versioned, comparable across time"
      }
    },
    {
      "id": "p-append-only-versioned-comparable-across-time",
      "kind": "paragraph",
      "data": {
        "text": "Once observations are the unit, the storage discipline follows. ADR-001 fixes an append-only rule: an observation is never rewritten as if it were a stable truth. Each observation carries the engine, the surface interrogated, the query panel version, the provider version, the extractor version, the aggregation version, the canonicalization version, the run identifier, the canonical measurement window, the observed timestamp and its status. A retry does not overwrite; a change of method does not silently rewrite history."
      }
    },
    {
      "id": "h-empty-results-are-observations-not-errors",
      "kind": "heading",
      "level": 2,
      "data": {
        "text": "Empty results are observations, not errors"
      }
    },
    {
      "id": "p-empty-results-are-observations-not-errors",
      "kind": "paragraph",
      "data": {
        "text": "A CMS mindset would treat an empty answer as a failed request. The observatory does not. ADR-001 fixes a canonical table of eight observation statuses, and only two of them — `ok` and `no_citations` — enter the denominator of the Share of Model. `no_answer_surface` (the answer surface was simply not triggered for this query) is a **valid observation**, not an error, and is deliberately excluded from the denominator. Transient errors (`rate_limited`, `timeout`, `provider_empty_response`, `provider_error`) are excluded from the measure and counted in the run's quality metrics instead."
      }
    },
    {
      "id": "h-postgres-and-trigger-dev-deliberate-boredom",
      "kind": "heading",
      "level": 2,
      "data": {
        "text": "Postgres and Trigger.dev — deliberate boredom"
      }
    },
    {
      "id": "p-postgres-and-trigger-dev-deliberate-boredom",
      "kind": "paragraph",
      "data": {
        "text": "ADR-001 is also, quietly, a decision to stay boring. TextOS V1 uses Next.js on Vercel, Neon Postgres in the EU, Drizzle ORM and Trigger.dev v4 for scheduled observation runs. No time-series extension. No dedicated queue. No object store for raw responses in V1. No external analytics engine."
      }
    },
    {
      "id": "h-idempotence-is-not-a-nice-to-have",
      "kind": "heading",
      "level": 2,
      "data": {
        "text": "Idempotence is not a nice-to-have"
      }
    },
    {
      "id": "p-idempotence-is-not-a-nice-to-have",
      "kind": "paragraph",
      "data": {
        "text": "Because retries are normal and scheduling is the default, ADR-001 elevates idempotence to an invariant. An observation is keyed by engine, surface, panel version, query hash, locale, measurement window, method version and execution index. A retry may not produce a duplicate; a change of method version, on the other hand, is not a duplicate — it is a new observation, potentially the first point of a new comparable series."
      }
    },
    {
      "id": "h-windows-are-frozen-not-sliding",
      "kind": "heading",
      "level": 2,
      "data": {
        "text": "Windows are frozen, not sliding"
      }
    },
    {
      "id": "p-windows-are-frozen-not-sliding",
      "kind": "paragraph",
      "data": {
        "text": "Another invariant that follows from taking the observatory seriously: measurement windows are **canonical and frozen**. Two consultations of the same report at two nearby moments must return the same value for the same window. TextOS does not compute the Share of Model on a sliding window that shifts silently between refreshes. If a sliding view is offered, it is a derived view, explicitly labelled, and never the measurement of record."
      }
    },
    {
      "id": "h-what-this-architecture-buys-and-what-it-costs",
      "kind": "heading",
      "level": 2,
      "data": {
        "text": "What this architecture buys, and what it costs"
      }
    },
    {
      "id": "p-what-this-architecture-buys-and-what-it-costs",
      "kind": "paragraph",
      "data": {
        "text": "The benefits are compounding rather than dramatic. Measurements remain reproducible under method evolution. Series carry their own method signature and can be refused for comparison when methods diverge. Volatility is treated as a domain property rather than a bug. Absence of measurement is preserved as absence of measurement, never coerced into a zero. The product's public claims — that Total is a union rather than a sum, that a signal not observable is not reported as zero, that the ledger contextualises rather than scores — are entailments of the schema, not slogans wrapped around it."
      }
    },
    {
      "id": "h-related-methodology",
      "kind": "heading",
      "level": 2,
      "data": {
        "text": "Related methodology"
      }
    }
  ],
  "relationships": {
    "relatedContentIds": []
  },
  "conversion": {
    "ctaIntentId": "MEASURE_BRAND",
    "conversionAllowed": true
  },
  "lifecycle": {
    "firstPublishedAt": null,
    "publishedAt": "2026-09-12",
    "updatedAt": "2026-09-12",
    "lastReviewedAt": "2026-09-13",
    "revisionNumber": 0
  },
  "seo": {
    "indexingIntent": "noindex",
    "canonicalPath": "/insights/observatory-not-cms",
    "schemaType": "TechArticle",
    "targetQuery": "textos observatory architecture not a cms",
    "searchIntent": "technical"
  }
}
