{
  "contentSchemaVersion": "content-document@1",
  "identity": {
    "documentId": "textos-site:ctc:ctc-every-change-a-content-decision",
    "contentType": "product_article",
    "slug": "why-most-product-changes-deserve-no-article",
    "language": "en-US",
    "title": "At TextOS, every product change carries a written content decision",
    "description": "Every TextOS product change has to state whether it deserves public content, and the usual answer, which costs one line, is that it does not."
  },
  "editorial": {
    "authorIds": [],
    "reviewerIds": [],
    "topicIds": [],
    "audience": "Buyer looking for a practical decision guide",
    "funnelStage": "consideration"
  },
  "truth": {
    "statusVocabulary": "geo-writer",
    "statusVocabularyVersion": "geo-writer@0.2",
    "sourceStatus": "ARTICLE_GUIDE",
    "publicationStatus": "draft",
    "allowedSurfaces": [
      "reference",
      "native"
    ],
    "claimIds": [
      "stmt:5:title:2:s1",
      "stmt:4:meta:2:s1",
      "stmt:4:lead:2:s1",
      "stmt:4:lead:2:s2",
      "stmt:4:lead:2:s3",
      "stmt:6:answer:2:s1",
      "stmt:6:answer:2:s2",
      "stmt:6:answer:2:s3",
      "stmt:6:answer:2:s4",
      "stmt:9:section-1:2:s1",
      "stmt:9:section-1:2:s2",
      "stmt:9:section-1:2:s4",
      "stmt:26:change-to-decision-caption:2:s1",
      "stmt:9:section-2:2:s1",
      "stmt:9:section-2:2:s2",
      "stmt:9:section-2:2:s3",
      "stmt:9:section-2:2:s4",
      "stmt:9:section-2:2:x1",
      "stmt:9:section-4:3:s11",
      "stmt:9:section-4:3:s12",
      "stmt:9:section-4:3:s21",
      "stmt:9:section-4:3:s22",
      "stmt:9:section-4:3:s23",
      "stmt:9:section-3:2:s1",
      "stmt:9:section-3:2:s2",
      "stmt:9:section-3:2:x1",
      "stmt:6:verify:2:s1",
      "stmt:6:verify:2:s2",
      "stmt:6:verify:2:s3",
      "stmt:6:verify:2:s4",
      "stmt:6:verify:2:s5",
      "stmt:19:editorial-next-step:2:s1",
      "stmt:19:editorial-next-step:2:s2"
    ],
    "evidenceRefs": [
      "ev-ci-01",
      "ev-ci-02",
      "ev-ci-08",
      "ev-ci-03",
      "ev-ci-04",
      "ev-ci-05",
      "ev-ci-09",
      "ev-ci-14",
      "ev-ci-12",
      "ev-ci-13",
      "ev-ci-06",
      "ev-ci-07",
      "ev-ci-11"
    ],
    "capabilityIds": []
  },
  "provenance": {
    "sourceAuthority": "UNCERTIFIED",
    "sourceEvidenceDigest": "ca9d555876f24b0a039d0ce4d63ba37721306a335e42d8fda1801126da05f393"
  },
  "body": [
    {
      "id": "answer-1",
      "kind": "answer",
      "slot": "short-answer",
      "data": {
        "text": "Automated checks in TextOS refuse a change that carries no content decision, but they never work that decision out themselves. One of the possible answers is simply that the change deserves no public content. That answer is also the usual one, and it costs a single line to give. In other words, people decide what is worth saying, and the tooling checks that they decided."
      }
    },
    {
      "id": "lead:body",
      "kind": "paragraph",
      "data": {
        "text": "It is tempting to turn each release into a blog post. TextOS decides change by change instead: each product change carries an explicit decision about what public content it deserves, if any. The rule is small, but it changes what a team feels obliged to publish."
      }
    },
    {
      "id": "section-1:heading",
      "kind": "heading",
      "level": 2,
      "data": {
        "text": "Why 'nothing to publish' has to be cheap"
      }
    },
    {
      "id": "section-1:body",
      "kind": "paragraph",
      "data": {
        "text": "A vocabulary that made 'nothing to publish' feel shameful would push teams to over-qualify their work in order to look productive. The TextOS decision file says it plainly: the change deserves no public content.\n\nCounting that answer as a valid outcome keeps your public pages for the changes that matter to buyers."
      }
    },
    {
      "id": "figure:change-to-decision",
      "kind": "figure",
      "data": {
        "src": "/diagrams/ctc/change-to-decision-16df45598024.svg",
        "alt": "How a product change gets its content decision. A 4-step flow: Product change, then Content decision written, then Checks require it, then Usually: no article. A dashed boundary after \"Content decision written\" is labelled People decide: The tooling checks that a decision exists, not what it is.",
        "caption": "Each TextOS product change carries an explicit content decision, which automated checks require but do not make, and the usual answer is that the change deserves no public content."
      }
    },
    {
      "id": "section-2:heading",
      "kind": "heading",
      "level": 2,
      "data": {
        "text": "The quiet failure it closes"
      }
    },
    {
      "id": "section-2:body",
      "kind": "paragraph",
      "data": {
        "text": "The quietest failure TextOS found was one where nothing fails. The evidence cited for a capability still exists, yet the public description keeps telling a truth about a product that has changed underneath it.\n\nChanging a file that TextOS cites as evidence, without saying anything about the related capability, is now refused, and accepting that gap means signing a sentence about it. The check behind it answers one mechanical question, whether a changed file is covered by declared evidence, and it infers no capability.\n\nTextOS found that gap next to a plainer one: a capability shipped but never declared."
      }
    },
    {
      "id": "section-4:heading",
      "kind": "heading",
      "level": 2,
      "data": {
        "text": "Content and coverage are two questions"
      }
    },
    {
      "id": "section-4:body",
      "kind": "paragraph",
      "data": {
        "text": "No tool at TextOS reads the code to guess that a change deserves an article. Whether a change deserves an article and whether it belongs to the described product are separate questions, answered separately.\n\nEach changed path that no declared evidence covers has to be explained by exactly one disposition in TextOS: none would be the silence the rule closes, and two or more would be ambiguous. A coverage debt does not turn the build red, but it stops a content candidate from becoming ready. Writing about a part of the product before it is described would put the article ahead of the facts."
      }
    },
    {
      "id": "section-3:heading",
      "kind": "heading",
      "level": 2,
      "data": {
        "text": "Govern first, write second"
      }
    },
    {
      "id": "section-3:body",
      "kind": "paragraph",
      "data": {
        "text": "TextOS refuses to propose content about a part of the product whose public description is still owed, since that would mean writing first and governing second. The contract itself writes no content and opens no editorial request.\n\nThe check runs on direct pushes as well as on pull requests, since changes reached the TextOS product by direct push."
      }
    },
    {
      "id": "verify:heading",
      "kind": "heading",
      "level": 2,
      "data": {
        "text": "What to ask any AI writing vendor"
      }
    },
    {
      "id": "verify:decision-points",
      "kind": "steps",
      "data": {
        "items": [
          "If your team publishes release notes, look at what it costs to say that a release deserves none.",
          "Ask who decides that a change is worth an article, and whether that choice is written down.",
          "Ask what happens to a published page when the product feature it describes changes.",
          "Before you let a tool draft articles from your release history, check which side of that order it sits on.",
          "Ask whether the check that guards your public pages also runs on changes that skip review."
        ]
      }
    },
    {
      "id": "editorial-next-step:heading",
      "kind": "heading",
      "level": 2,
      "data": {
        "text": "Where to go next"
      }
    },
    {
      "id": "editorial-next-step:body",
      "kind": "paragraph",
      "slot": "editorial-next-step",
      "data": {
        "text": "Another note shows how an article that was produced is told apart from one that was checked. A second note explains who may say yes to a source before an article can rely on it."
      }
    },
    {
      "id": "sources:heading",
      "kind": "heading",
      "level": 2,
      "data": {
        "text": "Sources"
      }
    },
    {
      "id": "source:1:ev-ci-01",
      "kind": "source",
      "data": {
        "ref": "ev-ci-01",
        "title": "TextOS product commit 4d37616, 5 Aug 2026"
      }
    },
    {
      "id": "source:2:ev-ci-02",
      "kind": "source",
      "data": {
        "ref": "ev-ci-02",
        "title": "TextOS product repository file changes/content-impact/README.md at 2faf90e"
      }
    },
    {
      "id": "source:3:ev-ci-05",
      "kind": "source",
      "data": {
        "ref": "ev-ci-05",
        "title": "TextOS product commit 1ad90d0, 8 Aug 2026"
      }
    }
  ],
  "relationships": {
    "relatedContentIds": []
  },
  "conversion": {
    "conversionAllowed": false
  },
  "lifecycle": {},
  "seo": {
    "indexingIntent": "noindex",
    "targetQuery": "how to decide which product changes deserve public content",
    "searchIntent": "buyer_decision"
  }
}
