{
  "contentSchemaVersion": "content-document@1",
  "identity": {
    "documentId": "textos-site:ctc:ctc-credentials-expire-and-stop",
    "contentType": "ARTICLE",
    "slug": "api-credentials-that-expire-and-a-switch-to-stop-them",
    "language": "en-US",
    "title": "Every new TextOS API credential now expires, after 30 days by default",
    "description": "TextOS API credentials expire after 30 days by default, an account can be revoked with all its keys, and switches can shut the API or its writes down."
  },
  "editorial": {
    "authorIds": [],
    "reviewerIds": [],
    "topicIds": []
  },
  "truth": {
    "statusVocabulary": "geo-writer",
    "statusVocabularyVersion": "geo-writer@0.2",
    "sourceStatus": "truthCheck:pass",
    "publicationStatus": "draft",
    "allowedSurfaces": [
      "reference"
    ],
    "claimIds": [],
    "evidenceRefs": [
      "ev-cr-08",
      "ev-cr-09",
      "ev-cr-03",
      "ev-cr-05",
      "ev-cr-14",
      "ev-cr-01",
      "ev-cr-10",
      "ev-cr-02",
      "ev-cr-04",
      "ev-cr-07",
      "ev-cr-15",
      "ev-cr-06",
      "ev-cr-12",
      "ev-cr-13",
      "ev-cr-11"
    ],
    "capabilityIds": []
  },
  "provenance": {
    "sourceAuthority": "UNCERTIFIED",
    "sourceEvidenceDigest": "9d60c498ac92346a98bb2ff32cf799b30b733b952323970529cc5eb3b663925c"
  },
  "body": [
    {
      "id": "lead",
      "kind": "paragraph",
      "data": {
        "text": "An access key handed to an outside agent tends to outlive the job it was created for. TextOS treated that permanent key as a gap to close before its first customer trial of the API. It also closed the operational control gap that a first customer would face."
      }
    },
    {
      "id": "answer",
      "kind": "answer",
      "data": {
        "text": "Every new TextOS credential gets a lifetime of 30 days by default, and no more than 90 days. A credential has to have at least 60 minutes left when it is issued, and a missing end date falls back to the 30-day default instead of creating a key that never ends. These limits are enforced by the TextOS service itself, not only by its command-line tool."
      }
    },
    {
      "id": "section-1",
      "kind": "paragraph",
      "data": {
        "text": "Replacing a key is a single step in TextOS: the old credential is revoked and its replacement recorded in one database transaction. The new key is shown once and is not stored in readable form.\n\nRevoking an account in TextOS also revokes every active credential it holds. Emergency actions go through a dedicated command-line tool, so nobody has to edit the database by hand under pressure."
      }
    },
    {
      "id": "section-2",
      "kind": "paragraph",
      "data": {
        "text": "TextOS has three switches for a bad day: one turns the whole API off, one freezes writes while keeping reads and diagnostics, and one denies a single named capability. A caller that reaches a switched-off path gets a clear answer to try again later rather than an ambiguous internal error.\n\nThe switches also apply inside the workers that run queued jobs, so turning the API off stops the backlog and not only new requests. Queued work is authorized again before it takes a place to run."
      }
    },
    {
      "id": "section-3",
      "kind": "paragraph",
      "data": {
        "text": "Keys issued in TextOS before lifetimes existed keep working until someone deliberately rotates them, which avoids an unannounced outage. That is a trade-off: an older key stays valid longer, but nobody's integration breaks without warning.\n\nWhen you assess a vendor's API, ask how long a key lives by default, whether it can be cut off in one step, and how keys issued before those rules are handled."
      }
    }
  ],
  "relationships": {
    "relatedContentIds": []
  },
  "conversion": {
    "conversionAllowed": false
  },
  "lifecycle": {},
  "seo": {
    "indexingIntent": "noindex"
  }
}
